proposed_use,existing_construction_type,status_date,proposed_units,proposed_construction_type,permit_number,description,revised_cost,street_name,supervisor_district,street_suffix,lot,filed_date,plansets,block,number_of_existing_stories,number_of_proposed_stories,neighborhoods_analysis_boundaries,permit_type_definition,permit_type,permit_creation_date,zipcode,record_id,proposed_construction_type_description,estimated_cost,street_number,existing_use,existing_units,location,status,existing_construction_type_description
apartments,5,2021-06-28T00:00:00.000,88,5,202106283313,"bldg 8 unit 407: like for like; remove and replace 1 kitchen cabinets, countertop, sink and faucet; 1 bathroom vanity, sink, faucet and toilet; lighting fixtures; outlets and switches w/ covers; no alarm/ sprinkler modifications; no removing walls.",26800,Bayside Village,6,Pl,100A,2021-06-28T00:00:00.000,0,3773,4,4,Financial District/South Beach,otc alterations permit,8,2021-06-28T00:00:00.000,94107,1619708471171,wood frame (5),26800,3,apartments,88,"{coordinates:[-122.39036919104052,37.78485937512485],type:Point}",issued,wood frame (5)
2 family dwelling,5,2021-06-28T00:00:00.000,2,5,202106283345,revision to pa# 2018082078117/s-1. make few structural changes to the original plans.,1,Vermont,10,St,001I,2021-06-28T00:00:00.000,2,4028,3,3,Potrero Hill,otc alterations permit,8,2021-06-28T00:00:00.000,94107,1619743391985,wood frame (5),1,632,2 family dwelling,2,"{coordinates:[-122.40452123583876,37.761624426402705],type:Point}",issued,wood frame (5)
1 family dwelling,5,2021-06-28T00:00:00.000,1,5,202106283303,"amendment to bpa#202007069610.  remodel 2/f bathroom, replace sink, bathroom & toilet, add (1) sink",20000,Bennington,9,St,030,2021-06-28T00:00:00.000,0,5666,2,2,Bernal Heights,otc alterations permit,8,2021-06-28T00:00:00.000,94110,1619699186335,wood frame (5),20000,5,1 family dwelling,1,"{coordinates:[-122.4174783007917,37.74026288544782],type:Point}",issued,wood frame (5)
office,1,2021-06-28T00:00:00.000,0,1,202106283348,29th floor: demo and build back of non-structural partitions. new walls  and finishes. new  ceilings. mep included.,0,California,3,St,026,2021-06-28T00:00:00.000,2,0259,52,52,Financial District/South Beach,otc alterations permit,8,2021-06-28T00:00:00.000,94104,161975266052,constr type 1,100000,555,office,0,"{coordinates:[-122.4034859548936,37.79226164705224],type:Point}",filed,constr type 1
apartments,5,2021-06-28T00:00:00.000,3,5,202106283360,"repair front stairecase less than 50%, repair the rear wooden deck per plans less than 50%, replace the (e) french door to new french doors on 1/f, replace the (e) french doors to new sliding doors on 2nd & 3rd floors.",0,Oak,5,St,026,2021-06-28T00:00:00.000,2,1224,3,3,Haight Ashbury,otc alterations permit,8,2021-06-28T00:00:00.000,94117,1619763396851,wood frame (5),20000,1769,apartments,3,"{coordinates:[-122.44837660927922,37.771447717644804],type:Point}",filed,wood frame (5)
1 family dwelling,5,2021-06-28T00:00:00.000,1,5,202106283308,"repairing deck and stairs (less than 50%). one in kind bathroom remodel, non structural.",20000,Everson,8,St,124,2021-06-28T00:00:00.000,0,7544,3,3,Glen Park,otc alterations permit,8,2021-06-28T00:00:00.000,94131,1619703228270,wood frame (5),20000,152,1 family dwelling,1,"{coordinates:[-122.43259159292505,37.73903942055057],type:Point}",issued,wood frame (5)
apartments,5,2021-06-29T00:00:00.000,3,5,202106283335,replace front door,1500,Pine,2,St,008A,2021-06-28T00:00:00.000,0,1028,3,3,Pacific Heights,otc alterations permit,8,2021-06-28T00:00:00.000,94115,1619732516407,wood frame (5),1500,2706,apartments,3,"{coordinates:[-122.44076251084732,37.78725753306419],type:Point}",issued,wood frame (5)
retail sales,3,2021-06-28T00:00:00.000,0,3,202106283323,installation at a emergency responder coverage system (errcs).,,Market,6,St,002,2021-06-28T00:00:00.000,2,0350,2,2,Tenderloin,additions alterations or repairs,3,2021-06-28T00:00:00.000,94102,161972170095,constr type 3,50000,1028,retail sales,0,"{coordinates:[-122.41129246701686,37.781888613912386],type:Point}",filed,constr type 3
1 family dwelling,5,2021-06-28T00:00:00.000,1,5,202106283336,remodel (3) (e) full bathrooms,60000,03rd,1,Av,013,2021-06-28T00:00:00.000,2,1430,3,3,Inner Richmond,otc alterations permit,8,2021-06-28T00:00:00.000,94118,161973399428,wood frame (5),60000,227,1 family dwelling,1,"{coordinates:[-122.46160205577561,37.78397570852555],type:Point}",filed,wood frame (5)
office,1,2021-06-28T00:00:00.000,,1,202106283370,"modifications to the level 8 roof of the podium portion of 101 california. scope includes the extension of two egress stairs to the roof, a new 2-stop elevator to connect l7 and l8, and a new waterproofing layer",,California,3,St,011,2021-06-28T00:00:00.000,2,0263,48,48,Financial District/South Beach,additions alterations or repairs,3,2021-06-28T00:00:00.000,94111,161977466081,constr type 1,4669527,101,office,,"{coordinates:[-122.39809861249968,37.79294896659278],type:Point}",filed,constr type 1
1 family dwelling,5,2021-06-28T00:00:00.000,1,5,202106283295,"replacing in kind 2 non-street facing windows, (e) aluminum with (n) wood composit.",8095,23rd,8,St,038,2021-06-28T00:00:00.000,0,3651,3,3,Noe Valley,otc alterations permit,8,2021-06-28T00:00:00.000,94114,1619690164048,wood frame (5),8095,3835,1 family dwelling,1,"{coordinates:[-122.42837666146607,37.75306690656326],type:Point}",issued,wood frame (5)
2 family dwelling,5,2021-06-28T00:00:00.000,2,5,202106283343,siding repair/ replacement to wood and windows rreplacement in-kind from vinyl to wood clad for all 4 sides of building.,0,Cayuga,8,Av,021,2021-06-28T00:00:00.000,0,6752,2,2,Outer Mission,otc alterations permit,8,2021-06-28T00:00:00.000,94112,1619740212129,wood frame (5),40000,68,2 family dwelling,2,"{coordinates:[-122.42998486366022,37.731631918461616],type:Point}",filed,wood frame (5)
apartments,5,2021-06-28T00:00:00.000,3,5,202106283339,to comply with nov #201711673. proposed dwelling unit (du) with plumbing and electricak work. dweling unit added "under density".,0,California,2,St,040,2021-06-28T00:00:00.000,2,0656,3,3,Pacific Heights,otc alterations permit,8,2021-06-28T00:00:00.000,94115,1619736517955,wood frame (5),20000,2685,2 family dwelling,2,"{coordinates:[-122.43852389197221,37.78814857113552],type:Point}",filed,wood frame (5)
office,5,2021-06-28T00:00:00.000,13,5,202106283314,"replacing doors with exactly same doors that are newer. 1 set of double doors at front side, like for like. no changes.",3000,Irving,4,St,022,2021-06-28T00:00:00.000,0,1726,4,4,Sunset/Parkside,otc alterations permit,8,2021-06-28T00:00:00.000,94122,1619710360665,wood frame (5),3000,2360,office,13,"{coordinates:[-122.48326417513377,37.763538928175706],type:Point}",issued,wood frame (5)
1 family dwelling,5,2021-06-28T00:00:00.000,1,5,202106283306,comply w/ complanit #202100859 enf enforcement; provide 20% of landscape & 50% permeability in front of house. replace (e) front indow w/ new wood clad window in same opening.,0,Phelan,7,Av,003,2021-06-28T00:00:00.000,2,3138,2,2,West of Twin Peaks,otc alterations permit,8,2021-06-28T00:00:00.000,94112,1619714153151,wood frame (5),3000,327,1 family dwelling,1,"{coordinates:[-122.45268734302553,37.72954830863071],type:Point}",filed,wood frame (5)
apartments,5,2021-06-28T00:00:00.000,5,5,202106283347,"upgrade fire alarm system to 5ft c 1103.7.6.1 low frequency sounders to be located in every bedroom & living room. manual pull stations and ceiling heat detector located near facu, near eits and top of main stair. fire cellular alarm communication for off-site monitoring",13850,Connecticut,10,St,005,2021-06-28T00:00:00.000,2,4035,3,3,Potrero Hill,otc alterations permit,8,2021-06-28T00:00:00.000,94107,1619747269037,wood frame (5),13850,326,apartments,5,"{coordinates:[-122.39776104409586,37.76204997316155],type:Point}",issued,wood frame (5)
1 family dwelling,5,2021-06-28T00:00:00.000,1,5,202106283302,repair of deck guard railing located at back of building. less than 50% of repaires to deck.,4500,Eastwood,7,Dr,028,2021-06-28T00:00:00.000,0,3163,2,2,West of Twin Peaks,otc alterations permit,8,2021-06-28T00:00:00.000,94112,1619698154189,wood frame (5),4500,160,1 family dwelling,1,"{coordinates:[-122.45702540402525,37.72887905434969],type:Point}",issued,wood frame (5)
2 family dwelling,,2021-06-28T00:00:00.000,,,202106283368,re-roofing: remove and replace roofing material / existing roofing material (in-kind),18000,Westwood,7,Dr,023,2021-06-28T00:00:00.000,0,3175,,,West of Twin Peaks,otc alterations permit,8,2021-06-28T00:00:00.000,94112,1619772154394,,18000,66,2 family dwelling,,"{coordinates:[-122.4588393938331,37.72687798195583],type:Point}",issued,
1 family dwelling,5,2021-06-28T00:00:00.000,1,5,202106283292,"revision to bpa 201803153777. revision reflects removal of a window from the scope of work. reduce scope infill, window at ne side.",1,Douglass,8,St,018B,2021-06-28T00:00:00.000,0,6556,3,3,Noe Valley,otc alterations permit,8,2021-06-28T00:00:00.000,94114,1619688207462,wood frame (5),1,1029,1 family dwelling,1,"{coordinates:[-122.43795610310445,37.74821128066702],type:Point}",filed,wood frame (5)
1 family dwelling,5,2021-06-28T00:00:00.000,1,5,202106283291,"remodeling kitchen, like to like. remodel 1/2 bathroom. non-structural.",42000,42nd,1,Av,004J,2021-06-28T00:00:00.000,0,1684,2,2,Outer Richmond,otc alterations permit,8,2021-06-28T00:00:00.000,94121,1619687110154,wood frame (5),42000,810,1 family dwelling,1,"{coordinates:[-122.50222756473184,37.773340427105566],type:Point}",issued,wood frame (5)
1 family dwelling,5,2021-06-28T00:00:00.000,1,5,202106283371,"construct 2-story horizontal rear addition to existing 2-story single family dwelling. on 2nd floor, add bedroom, full bathroom, and sunroom. ground floor add workshop and storage space.",,Otsego,11,Av,027,2021-06-28T00:00:00.000,2,6951,2,2,Outer Mission,additions alterations or repairs,3,2021-06-28T00:00:00.000,94112,1619775215069,wood frame (5),150000,428,1 family dwelling,1,"{coordinates:[-122.44198143653878,37.72247891735291],type:Point}",filed,wood frame (5)
1 family dwelling,5,2021-06-30T00:00:00.000,1,5,202106283366,remodel ground floor bonus room to family room with bath and closet. add 1/2 bath at hallway. add 1 storage at front of garage.,50888,Plymouth,7,Av,007,2021-06-28T00:00:00.000,2,3199,2,2,West of Twin Peaks,otc alterations permit,8,2021-06-28T00:00:00.000,94112,1619770154710,wood frame (5),50888,1254,1 family dwelling,1,"{coordinates:[-122.45620743228085,37.725121877074926],type:Point}",issued,wood frame (5)
1 family dwelling,5,2021-06-28T00:00:00.000,1,5,202106283356,second floor new deck and stairway at rear of building.,0,Rae,11,Av,045A,2021-06-28T00:00:00.000,2,7100,2,2,Outer Mission,otc alterations permit,8,2021-06-28T00:00:00.000,94112,1619759221484,wood frame (5),3000,126,1 family dwelling,1,"{coordinates:[-122.44933321755286,37.711524821646066],type:Point}",filed,wood frame (5)
apartments,5,2021-06-28T00:00:00.000,94,5,202106283310,"bldg 7 unit 417: like for like: remove and replace kitchen cabinets, countertops, sink and faucet. bathrooms vanity, sink faucet and toilet; lighting fixtures, outlets, switches w/covers; no fire sprinkler/alarm modifications no removiing walls.",26800,Bayside Village,6,Pl,100A,2021-06-28T00:00:00.000,0,3773,4,4,Financial District/South Beach,otc alterations permit,8,2021-06-28T00:00:00.000,94107,1619707470801,wood frame (5),26800,2,apartments,94,"{coordinates:[-122.39036919104052,37.78485937512485],type:Point}",issued,wood frame (5)
apartments,5,2021-06-30T00:00:00.000,5,5,202106283333,revision to pa #201709158769. foundation field revision.,6000,Clayton,5,St,020,2021-06-28T00:00:00.000,2,1231,3,3,Haight Ashbury,otc alterations permit,8,2021-06-28T00:00:00.000,94117,161973093172,wood frame (5),1,544,apartments,5,"{coordinates:[-122.44835020739126,37.77012873105947],type:Point}",issued,wood frame (5)
apartments,1,2021-06-29T00:00:00.000,449,1,202106283324,"#350 -kitchen and one bedroom remodel, add 4 recessed lights in the  bedroom. no removal wall, and no new openings.",49500,Van Ness,5,Av,350,2021-06-28T00:00:00.000,0,0762,13,13,Western Addition,otc alterations permit,8,2021-06-28T00:00:00.000,94110,161980381292,constr type 1,49500,601,apartments,449,"{coordinates:[-122.42140632584281,37.78138577762951],type:Point}",issued,constr type 1
1 family dwelling,5,2021-06-28T00:00:00.000,1,5,202106283294,"replace siding & windows back of house, repair (e) siding, add vapor wrap, build up trim around windows & doors.  add new vinyl lap siding, 1,800 sq. ft., 30 l.ft. (not street facing), replace (2)(e) wood w/wood vinyl windows, retrofit, u-factor max 0.29",39954,09th,7,Av,030,2021-06-28T00:00:00.000,0,2861,3,3,West of Twin Peaks,otc alterations permit,8,2021-06-28T00:00:00.000,94116,1619691146123,wood frame (5),39954,2242,1 family dwelling,1,"{coordinates:[-122.46574541545965,37.74727513987902],type:Point}",issued,wood frame (5)
apartments,1,2021-06-30T00:00:00.000,86,1,202106283331,one for one replacement of (e) broken fire alarm system cell dialer added for communication. building to be updated to code compliance in separate permit,37073,Sacramento,2,St,018,2021-06-28T00:00:00.000,2,0640,10,10,Pacific Heights,otc alterations permit,8,2021-06-28T00:00:00.000,94109,1619728396321,constr type 1,20000,2055,apartments,86,"{coordinates:[-122.42664599915403,37.790483369302045],type:Point}",issued,constr type 1
apartments,5,2021-07-02T00:00:00.000,5,5,202106283305,reroofing,12000,Clement,1,St,022,2021-06-28T00:00:00.000,0,1414,3,3,Outer Richmond,otc alterations permit,8,2021-06-28T00:00:00.000,94121,1619702281329,wood frame (5),12000,1834,apartments,5,"{coordinates:[-122.47908394452699,37.782529106712175],type:Point}",complete,wood frame (5)
apartments,5,2021-06-28T00:00:00.000,5,5,202106283347,"upgrade fire alarm system to 5ft c 1103.7.6.1 low frequency sounders to be located in every bedroom & living room. manual pull stations and ceiling heat detector located near facu, near eits and top of main stair. fire cellular alarm communication for off-site monitoring",13850,Connecticut,10,St,005,2021-06-28T00:00:00.000,2,4035,3,3,Potrero Hill,otc alterations permit,8,2021-06-28T00:00:00.000,94107,1619749269039,wood frame (5),13850,330,apartments,5,"{coordinates:[-122.39776104409586,37.76204997316155],type:Point}",issued,wood frame (5)
apartments,5,2021-06-28T00:00:00.000,119,5,202106283296,"building 5-unti 314: like for like remove and replace 1 kitchen cabinets, countertop, sink and faucet, 1 bathroom vanity, sink, faucet and toilet, lighting fixtures, outlets, switches with covers, no fire sprinkled/alarm modifications, no removing walls.",26800,Beale,6,St,200A,2021-06-28T00:00:00.000,0,3773,4,4,Financial District/South Beach,otc alterations permit,8,2021-06-28T00:00:00.000,94105,1619692471169,wood frame (5),26800,500,apartments,119,"{coordinates:[-122.38942605670827,37.78546640744892],type:Point}",issued,wood frame (5)
1 family dwelling,5,2021-06-29T00:00:00.000,1,5,202106283355,bathroom remodel - add & remove non structural wall on 2/f,16000,Restani,11,Wy,001B,2021-06-28T00:00:00.000,2,7029,2,2,Outer Mission,otc alterations permit,8,2021-06-28T00:00:00.000,94112,1619758218227,wood frame (5),16000,65,1 family dwelling,1,"{coordinates:[-122.44385334019094,37.71788392230195],type:Point}",issued,wood frame (5)
1 family dwelling,5,2021-06-28T00:00:00.000,1,5,202106283338,2/f: interior renovations include kitchen and bath remodel. adding a new master bath and relocating laundry to 2nd floor.,50000,18th,1,Av,030,2021-06-28T00:00:00.000,2,1449,2,2,Outer Richmond,otc alterations permit,8,2021-06-28T00:00:00.000,94121,1619735100186,wood frame (5),50000,342,1 family dwelling,1,"{coordinates:[-122.47698767940443,37.78154557829218],type:Point}",filed,wood frame (5)
1 family dwelling,5,2021-06-28T00:00:00.000,1,5,202106283357,rev to 202008121589 to struct foundation  design to accomodate existing conditions @ south foundation wall.,0,12th,7,Av,016,2021-06-28T00:00:00.000,2,2337,2,2,West of Twin Peaks,otc alterations permit,8,2021-06-28T00:00:00.000,94116,1619761131720,wood frame (5),1,2201,1 family dwelling,1,"{coordinates:[-122.46872110273213,37.747150935241244],type:Point}",filed,wood frame (5)
2 family dwelling,,2021-06-28T00:00:00.000,,,202106283322,re-roofing: remove and replace roofing material / existing roofing material (in-kind),10000,42nd,4,Av,006C,2021-06-28T00:00:00.000,0,2162,,,Sunset/Parkside,otc alterations permit,8,2021-06-28T00:00:00.000,94116,1619720128003,,10000,2043,2 family dwelling,,"{coordinates:[-122.50112636012888,37.74857783527585],type:Point}",issued,
apartments,5,2021-06-28T00:00:00.000,12,5,202106283301,"unit 5: remodel 1 kitchen (new counter, cabinets, appliances) approx 30 sf. remodel 1 bath (new tub, toilet, sink) approx 45 sf. mo moving walls, all existing to be remain the same",30000,Chestnut,2,St,026,2021-06-28T00:00:00.000,0,0492,3,3,Marina,otc alterations permit,8,2021-06-28T00:00:00.000,94123,1619696234547,wood frame (5),30000,1901,apartments,12,"{coordinates:[-122.43479951440668,37.800827605670094],type:Point}",issued,wood frame (5)
apartments,5,2021-06-28T00:00:00.000,3,5,202106283360,"repair front stairecase less than 50%, repair the rear wooden deck per plans less than 50%, replace the (e) french door to new french doors on 1/f, replace the (e) french doors to new sliding doors on 2nd & 3rd floors.",0,Oak,5,St,026,2021-06-28T00:00:00.000,2,1224,3,3,Haight Ashbury,otc alterations permit,8,2021-06-28T00:00:00.000,94117,1619765396852,wood frame (5),20000,1773,apartments,3,"{coordinates:[-122.44837660927922,37.771447717644804],type:Point}",filed,wood frame (5)
apartments,1,2021-06-28T00:00:00.000,273,1,202106283334,"unit 41 penthouse b: existing vacant space for an interior remodel for 4 bedroom sfd with 4.5 baths, kitchen, dining, living, bar area. all existing perimeter enclosures to remain.",0,Folsom,6,St,662,2021-06-28T00:00:00.000,2,3746,43,43,Financial District/South Beach,otc alterations permit,8,2021-06-28T00:00:00.000,94105,1619731517725,constr type 1,550000,201,apartments,273,"{coordinates:[-122.39185027698642,37.788681782874875],type:Point}",filed,constr type 1
1 family dwelling,5,2021-06-25T00:00:00.000,1,5,202106253266,"add one bedroom, family room, one bath in ground floor.",0,34th,4,Av,040,2021-06-25T00:00:00.000,2,2016,2,2,Sunset/Parkside,otc alterations permit,8,2021-06-25T00:00:00.000,94122,1619660121990,wood frame (5),55000,1746,1 family dwelling,1,"{coordinates:[-122.49228788214369,37.754523128643314],type:Point}",filed,wood frame (5)
1 family dwelling,5,2021-06-25T00:00:00.000,1,5,202106253209,"bathroom remodel - replace floor tiles, wall tiles, vanity, a window, a skylight, and doors",15000,San Pablo,7,Av,030,2021-06-25T00:00:00.000,0,3011,3,3,West of Twin Peaks,otc alterations permit,8,2021-06-25T00:00:00.000,94127,1619598150117,wood frame (5),15000,143,1 family dwelling,1,"{coordinates:[-122.46198205383084,37.73752932235936],type:Point}",issued,wood frame (5)
apartments,5,2021-06-28T00:00:00.000,12,5,202106253259,"unit 101: revision to bpa#202103055991 to submit plans for converting (e) kitchen to study, relocate kitchen, rehabilitate (e) bathroom, install washer/dryer",30000,Pierce,2,St,001E,2021-06-25T00:00:00.000,2,0537,4,4,Marina,otc alterations permit,8,2021-06-25T00:00:00.000,94123,1619653235090,wood frame (5),20000,2845,apartments,12,"{coordinates:[-122.43897435053876,37.79630664684886],type:Point}",issued,wood frame (5)
1 family dwelling,5,2021-06-25T00:00:00.000,1,5,202106253212,replace (e) tub with (n) walk-in tub model cp5116. install (n) 20-amp circuit for tub outlet. dry wall patch.,9500,Alemany,8,Bl,046,2021-06-25T00:00:00.000,0,6786,2,2,Outer Mission,otc alterations permit,8,2021-06-25T00:00:00.000,94112,1619601213173,wood frame (5),9500,1276,1 family dwelling,1,"{coordinates:[-122.43257256699366,37.73045447636774],type:Point}",issued,wood frame (5)
1 family dwelling,5,2021-06-25T00:00:00.000,1,5,202106253195,proposed rear addition.,,23rd,4,Av,010,2021-06-25T00:00:00.000,2,1830,3,3,Sunset/Parkside,additions alterations or repairs,3,2021-06-25T00:00:00.000,94122,1619583116258,wood frame (5),300000,1441,1 family dwelling,1,"{coordinates:[-122.48155190995949,37.760696218528594],type:Point}",filed,wood frame (5)
tourist hotel/motel,,2021-06-25T00:00:00.000,195,1,202106253256,to review a revised fire protection piping plan with rgard to pa 201903225967 which change pipe routing because of the constructibility issue.,1,Ellis,3,St,011,2021-06-25T00:00:00.000,2,0327,,13,Financial District/South Beach,otc alterations permit,8,2021-06-25T00:00:00.000,94108,161964969769,constr type 1,1,72,vacant lot,,"{coordinates:[-122.40744227191061,37.785799044504984],type:Point}",issued,
apartments,1,2021-06-25T00:00:00.000,23,1,202106253232,stucco demo and replacement at french door. remove and replace concrete patio slab. @ unit 203 patio.remove & reset door after new waterproofing. install new drains. install proper slop & cim.pour new concrete slab unit 203 replace 3 coat stucco system around door.,42974.82,Bay,3,St,109,2021-06-25T00:00:00.000,0,0041,4,4,North Beach,otc alterations permit,8,2021-06-25T00:00:00.000,94133,1619624456163,constr type 1,42974.82,329,apartments,23,"{coordinates:[-122.41265292177418,37.8054765765045],type:Point}",issued,constr type 1
apartments,5,2021-06-25T00:00:00.000,3,5,202106253215,"replace 67 windows with same style and materials that were originally planned, approved & consdtructed for this building. original hardware & casement windows was not stainless steel cestal hardware & rusted  & wdw need to be replaced. original vinyl windows to be replace with same kind.",120000,Noriega,4,St,059,2021-06-25T00:00:00.000,0,2004,4,4,Sunset/Parkside,otc alterations permit,8,2021-06-25T00:00:00.000,94122,1619605491930,wood frame (5),120000,3892,apartments,3,"{coordinates:[-122.50524270506335,37.75319444685489],type:Point}",issued,wood frame (5)
apartments,5,2021-06-25T00:00:00.000,4,5,202106253199,"to comply with his nov 202178936. provide handrails at rear exterior deck stairs, one side with four risers. on ceiling of side enterance, tradesman corrider. provide 5/8 type x sheetrock/fire tape or plaster to restore 1 hr. fire separation integrity.",2000,16th,8,St,018,2021-06-25T00:00:00.000,0,3558,3,3,Castro/Upper Market,otc alterations permit,8,2021-06-25T00:00:00.000,94114,1619587247282,wood frame (5),80,3460,apartments,4,"{coordinates:[-122.43013178236424,37.76468001157049],type:Point}",issued,wood frame (5)
1 family dwelling,5,2021-06-25T00:00:00.000,1,5,202106253197,"remove and replace in-kind of dry-rot decking,landing entry,and steps. less than 50%. stairs at the front of the bldg.",3000,Teddy,10,Av,015,2021-06-25T00:00:00.000,0,6204,2,2,Visitacion Valley,otc alterations permit,8,2021-06-25T00:00:00.000,94134,1619585198367,wood frame (5),2000,48,1 family dwelling,1,"{coordinates:[-122.40308473563837,37.71362075878361],type:Point}",issued,wood frame (5)
1 family dwelling,5,2021-06-25T00:00:00.000,1,5,202106253242,"interior remodel including family room, 2nd fl powder room, erd fl bath, no struc changes. remodel kitchen and widen doorway between kitchen and dining room",114235,Rosewood,7,Dr,030,2021-06-25T00:00:00.000,2,3039,3,3,West of Twin Peaks,otc alterations permit,8,2021-06-25T00:00:00.000,94127,1619634150678,wood frame (5),114235,39,1 family dwelling,1,"{coordinates:[-122.46020781624512,37.734213179880015],type:Point}",issued,wood frame (5)
apartments,1,2021-06-25T00:00:00.000,67,1,202106253206,1 complete kitchen remodel like for like. 1 complete bathroom remodel like for like. no layout or wall changes.,25000,Folsom,6,St,066,2021-06-25T00:00:00.000,0,3744,18,18,Financial District/South Beach,otc alterations permit,8,2021-06-25T00:00:00.000,94105,1619594165765,constr type 1,25000,75,apartments,67,"{coordinates:[-122.3897573227413,37.78980325322287],type:Point}",issued,constr type 1
office,1,2021-06-25T00:00:00.000,,1,202106253218,floor 14/b: additions of 2 speaker/strobes for the restroom on floor 14b. ref pa202103015598. maher n/a.,1270,Market,6,St,007,2021-06-25T00:00:00.000,2,3713,27,27,Financial District/South Beach,otc alterations permit,8,2021-06-25T00:00:00.000,94105,1619609164605,constr type 1,1270,1,office,,"{coordinates:[-122.39420507489159,37.79335721959559],type:Point}",issued,constr type 1
2 family dwelling,5,2021-06-25T00:00:00.000,2,5,202106253228,remove and replace decking. repair framing. replace railings. repair dryrot,0,Malta,7,Dr,019,2021-06-25T00:00:00.000,2,3034,3,3,West of Twin Peaks,otc alterations permit,8,2021-06-25T00:00:00.000,94131,1619621496261,wood frame (5),10000,84,2 family dwelling,2,"{coordinates:[-122.44411994593045,37.736196956966964],type:Point}",filed,wood frame (5)
1 family dwelling,5,2021-06-25T00:00:00.000,1,5,202106253217,install new fire sprinkler system throughout building per nfpa 13 including 2" dedicated underground fire sprinkler service per nfpa 24. total sprinklers 64. ref pa 2021-0528-1309,34944,Sanchez,8,St,033,2021-06-25T00:00:00.000,2,3627,4,4,Noe Valley,otc alterations permit,8,2021-06-25T00:00:00.000,94114,1619608163045,wood frame (5),34944,939,1 family dwelling,1,"{coordinates:[-122.42954295351845,37.75410267710902],type:Point}",issued,wood frame (5)
apartments,5,2021-06-25T00:00:00.000,3,5,202106253226,"repair fire damaged area, repaint damaged walls, install new kitchen cabinets, change plumbing from galvanized to copper, bring electrical/plumbing up to code.  work @ (3) units, (1) kitchen remodel",34000,Leavenworth,3,St,014,2021-06-25T00:00:00.000,0,0252,3,3,Nob Hill,otc alterations permit,8,2021-06-25T00:00:00.000,94109,1619618283633,wood frame (5),34000,1024,apartments,3,"{coordinates:[-122.41537655966852,37.790644221708945],type:Point}",issued,wood frame (5)
