proposed_use,existing_construction_type,status_date,proposed_units,proposed_construction_type,permit_number,description,revised_cost,street_name,supervisor_district,street_suffix,lot,filed_date,plansets,block,number_of_existing_stories,number_of_proposed_stories,neighborhoods_analysis_boundaries,permit_type_definition,permit_type,permit_creation_date,zipcode,record_id,proposed_construction_type_description,estimated_cost,street_number,existing_use,existing_units,location,status,existing_construction_type_description
2 family dwelling,5,2021-06-23T00:00:00.000,2,5,202106233003,"change kitchen cabinets and top floors, sink, rangehood. change toilet,flooring,and sink. kitchen and bathroom remodel.",37500,Moraga,7,St,025,2021-06-23T00:00:00.000,0,1933,2,2,Inner Sunset,otc alterations permit,8,2021-06-23T00:00:00.000,94122,1619366361165,wood frame (5),37500,446,2 family dwelling,2,"{coordinates:[-122.46767417387116,37.75674905702424],type:Point}",issued,wood frame (5)
apartments,5,2021-06-23T00:00:00.000,30,5,202106233042,unit 13: demo & repair less than 50 sf of stucco for waterproofing & flashing. not visible from street.,10000,Minnesota,10,St,140,2021-06-23T00:00:00.000,0,4228,4,4,Potrero Hill,otc alterations permit,8,2021-06-23T00:00:00.000,94107,1619415425256,wood frame (5),10000,1310,apartments,30,"{coordinates:[-122.39006834720566,37.753699913944274],type:Point}",issued,wood frame (5)
1 family dwelling,5,2021-06-28T00:00:00.000,1,5,202106233005,replacing in kind (3) street facing windows (e) wood (n) is wood interior aluminum cald exterior.,8372,Persia,11,Av,018,2021-06-23T00:00:00.000,0,6082,2,2,Excelsior,otc alterations permit,8,2021-06-23T00:00:00.000,94112,1619368195625,wood frame (5),8372,137,1 family dwelling,1,"{coordinates:[-122.43448083930659,37.722673921822405],type:Point}",issued,wood frame (5)
apartments,5,2021-06-23T00:00:00.000,4,5,202106233010,7 double hung sashes - street view. wood in wood out. top sashes with ogee luggs.,14800,Noe,8,St,044,2021-06-23T00:00:00.000,0,3538,2,2,Castro/Upper Market,otc alterations permit,8,2021-06-23T00:00:00.000,94114,1619373246775,wood frame (5),14800,43,apartments,4,"{coordinates:[-122.43309763817354,37.768442143531175],type:Point}",issued,wood frame (5)
2 family dwelling,,2021-06-29T00:00:00.000,,,202106233061,re-roofing: remove and replace roofing material / existing roofing material (in-kind),9000,47th,4,Av,030,2021-06-23T00:00:00.000,0,2447,,,Sunset/Parkside,otc alterations permit,8,2021-06-23T00:00:00.000,94116,1619438136556,,9000,2594,2 family dwelling,,"{coordinates:[-122.50521837506193,37.738152939802106],type:Point}",complete,
1 family dwelling,5,2021-06-23T00:00:00.000,1,5,202106233032,remodel bathroom like-for-like,20000,Minerva,11,St,011,2021-06-23T00:00:00.000,0,7067,2,2,Oceanview/Merced/Ingleside,otc alterations permit,8,2021-06-23T00:00:00.000,94112,1619404220106,wood frame (5),20000,56,1 family dwelling,1,"{coordinates:[-122.45533511323256,37.71603816226953],type:Point}",issued,wood frame (5)
apartments,5,2021-06-23T00:00:00.000,3,5,202106233041,"replace (13) street facing windows w/primed wood sash kit. original jamb/trim will stay intact, sashes will change from (e) wood wingle pan to new wood double pane w/lugs.  size for size, kind-for-kind",54434,Bush,5,St,051,2021-06-23T00:00:00.000,0,0660,3,3,Pacific Heights,otc alterations permit,8,2021-06-23T00:00:00.000,94115,1619414257683,wood frame (5),54434,2168,apartments,3,"{coordinates:[-122.43298085397424,37.78730609482038],type:Point}",issued,wood frame (5)
1 family dwelling,5,2021-06-25T00:00:00.000,1,5,202106233073,"alter/rearrange bath on 2nd fl, first floor add (n) full bath, media room, and wet bar. relocate laundry, fau, and water heater. (n) window opening at the rear non-visible to the street.",38000,Ellsworth,9,St,032,2021-06-23T00:00:00.000,2,5813,2,2,Bernal Heights,otc alterations permit,8,2021-06-23T00:00:00.000,94110,1619451188850,wood frame (5),38000,739,1 family dwelling,1,"{coordinates:[-122.4148073595108,37.73405421196503],type:Point}",issued,wood frame (5)
apartments,5,2021-06-23T00:00:00.000,15,5,202106233027,"unit 7: remodel (1) kitchen & (1) bathroom, new cabinets, counters, upgrade electrical panel",36800,Hyde,3,St,013,2021-06-23T00:00:00.000,0,0219,4,4,Nob Hill,otc alterations permit,8,2021-06-23T00:00:00.000,94109,1619397232957,wood frame (5),35000,1224,apartments,15,"{coordinates:[-122.41742512712659,37.79233785573963],type:Point}",issued,wood frame (5)
apartments,1,2021-06-23T00:00:00.000,136,1,202106233033,unit n2101:  remodel kitchen and bathroom like-for-like,36800,01st,6,St,169,2021-06-23T00:00:00.000,0,3748,20,20,Financial District/South Beach,otc alterations permit,8,2021-06-23T00:00:00.000,94105,1619405447248,constr type 1,30000,333,apartments,136,"{coordinates:[-122.39359275679509,37.7870244572142],type:Point}",issued,constr type 1
office,1,2021-06-23T00:00:00.000,,1,202106233034,revision to pa 202102255357 to request technical infeasability ato mens and womens accessible restroom stall.,1,Fremont,6,St,018,2021-06-23T00:00:00.000,2,3719,27,27,Financial District/South Beach,otc alterations permit,8,2021-06-23T00:00:00.000,94105,1619406480611,constr type 1,1,199,office,,"{coordinates:[-122.39485668317657,37.789918160287],type:Point}",filed,constr type 1
apartments,5,2021-06-23T00:00:00.000,119,5,202106233022,"building 5/unit 103: like-for-like, remove/replace (1) kitchen cabinets, countertop, sink & faucet, (1) bathroom, vanity, sink, faucet & toilet.  lighting fixtures, outlets, switches w/covers, no fire sprinkler/alarm modification, no removing walls",26800,Beale,6,St,200A,2021-06-23T00:00:00.000,0,3773,4,4,Financial District/South Beach,otc alterations permit,8,2021-06-23T00:00:00.000,94105,1619390471169,wood frame (5),32000,500,apartments,119,"{coordinates:[-122.38942605670827,37.78546640744892],type:Point}",issued,wood frame (5)
1 family dwelling,5,2021-06-23T00:00:00.000,1,5,202106233001,replacing in kind (3) street facing windows (e) is aluminum (n) is wood composite.,11373,07th,5,Av,034,2021-06-23T00:00:00.000,0,1847,2,2,Inner Sunset,otc alterations permit,8,2021-06-23T00:00:00.000,94122,1619364117133,wood frame (5),11373,1466,1 family dwelling,1,"{coordinates:[-122.46362731275468,37.76104354177038],type:Point}",filed,wood frame (5)
2 family dwelling,5,2021-06-23T00:00:00.000,2,5,202106233044,stair replacement at the back,,47th,4,Av,046,2021-06-23T00:00:00.000,2,1806,3,3,Sunset/Parkside,additions alterations or repairs,3,2021-06-23T00:00:00.000,94122,1619418408206,wood frame (5),18000,1447,2 family dwelling,2,"{coordinates:[-122.50726292340119,37.759464581269526],type:Point}",filed,wood frame (5)
apartments,5,2021-06-23T00:00:00.000,4,5,202106233010,7 double hung sashes - street view. wood in wood out. top sashes with ogee luggs.,14800,Noe,8,St,044,2021-06-23T00:00:00.000,0,3538,2,2,Castro/Upper Market,otc alterations permit,8,2021-06-23T00:00:00.000,94114,1619374397815,wood frame (5),14800,45,apartments,4,"{coordinates:[-122.43309763817354,37.768442143531175],type:Point}",issued,wood frame (5)
apartments,5,2021-06-23T00:00:00.000,8,5,202106233080,"soft story retrofit to comply with sfebc 4d, mandatory seismic retrofit per 2016 cebc appendix a-4.",0,Liberty,8,St,048,2021-06-23T00:00:00.000,2,3608,3,3,Mission,otc alterations permit,8,2021-06-23T00:00:00.000,94110,1619458161759,wood frame (5),110000,70,apartments,8,"{coordinates:[-122.42266745055721,37.75785888100707],type:Point}",filed,wood frame (5)
apartments,5,2021-06-23T00:00:00.000,3,5,202106233036,3/f: remodel kitchen and bath. add dining room,49000,04th,1,Av,008,2021-06-23T00:00:00.000,2,1547,3,3,Inner Richmond,otc alterations permit,8,2021-06-23T00:00:00.000,94121,1619408103782,wood frame (5),45000,529,apartments,3,"{coordinates:[-122.46228592584092,37.7785575965673],type:Point}",issued,wood frame (5)
filling/service stn,2,2021-06-23T00:00:00.000,,2,202106233062,"remove kiosk - modify (e) canopy colums - (n) 727 sq ft under canopy kiosk. remove (e) underground fuel tank and piping, install (n) underground fuel tank and piping. paining (e) restroom & storage to match kiosk. add bathroom",0,Van Ness,2,Av,004,2021-06-23T00:00:00.000,2,0647,1,1,Western Addition,otc alterations permit,8,2021-06-23T00:00:00.000,94109,161943977553,constr type 2,1700000,1501,filling/service stn,,"{coordinates:[-122.42261402433878,37.78960856791808],type:Point}",filed,constr type 2
apartments,5,2021-06-25T00:00:00.000,8,5,202106233076,unit #8: remdel kitchen & convert dining to bedroom.,22000,San Bruno,9,Av,005,2021-06-23T00:00:00.000,2,6049,3,3,Portola,otc alterations permit,8,2021-06-23T00:00:00.000,94134,1619454412630,wood frame (5),22000,2840,apartments,8,"{coordinates:[-122.40317995156082,37.72580473386423],type:Point}",issued,wood frame (5)
2 family dwelling,5,2021-06-23T00:00:00.000,2,5,202106233044,stair replacement at the back,,47th,4,Av,046,2021-06-23T00:00:00.000,2,1806,3,3,Sunset/Parkside,additions alterations or repairs,3,2021-06-23T00:00:00.000,94122,1619417408205,wood frame (5),18000,1445,2 family dwelling,2,"{coordinates:[-122.50726292340119,37.759464581269526],type:Point}",filed,wood frame (5)
apartments,5,2021-06-23T00:00:00.000,110,5,202106233031,"bldg 4, unit 311 - like for like; remove and replace 1 kitchen cabinets, countertops, sink and faucet; 2 bathrooms vanity, sink faucet and toilet; lighting fixtures, outlets, switches w.covers; no fire sprinkler/alarm modifications; no removing walls",39000,Beale,6,St,200A,2021-06-23T00:00:00.000,0,3773,4,4,Financial District/South Beach,otc alterations permit,8,2021-06-23T00:00:00.000,94105,1619402471166,wood frame (5),39000,570,apartments,110,"{coordinates:[-122.38942605670827,37.78546640744892],type:Point}",issued,wood frame (5)
food/beverage hndlng,,2021-06-23T00:00:00.000,,,202106233084,"new restaurant called dumpling union.  work include new all gender restroom, stair and kitchen equipment.",0,Union,2,St,034,2021-06-23T00:00:00.000,0,0543,,,Marina,otc alterations permit,8,2021-06-23T00:00:00.000,94123,1619464376370,,150000,1809,food/beverage hndlng,,"{coordinates:[-122.42917333004992,37.797692516185954],type:Point}",filed,
apartments,5,2021-06-23T00:00:00.000,4,5,202106233023,replace 7 windows like for like retrofit. 6 street facing xo sliding. 1 non street facing xo sliding,6500,Hayes,5,St,028,2021-06-23T00:00:00.000,0,1195,3,3,Lone Mountain/USF,otc alterations permit,8,2021-06-23T00:00:00.000,94117,161939192015,wood frame (5),6500,1930,apartments,4,"{coordinates:[-122.4483507156413,37.77393791434259],type:Point}",filed,wood frame (5)
1 family dwelling,5,2021-06-23T00:00:00.000,1,5,202106233060,revision to app#202008051173 2/25/21. changed incorrect discription "remodel" off plan. change incorrect discription "study" to storage room. no change to addition to plans same as 2/25/21,1,Oneida,11,Av,010C,2021-06-23T00:00:00.000,2,6951,2,2,Outer Mission,otc alterations permit,8,2021-06-23T00:00:00.000,94112,1619437215047,wood frame (5),25000,272,1 family dwelling,1,"{coordinates:[-122.44320112514578,37.72222336617922],type:Point}",issued,wood frame (5)
1 family dwelling,5,2021-06-23T00:00:00.000,1,5,202106233059,revision to pa# 2020/0625/9150. foundation. this set replaces all structural drawings.,0,Castro,8,St,004,2021-06-23T00:00:00.000,2,2752,3,3,Castro/Upper Market,otc alterations permit,8,2021-06-23T00:00:00.000,94114,1619435143352,wood frame (5),1,708,1 family dwelling,1,"{coordinates:[-122.43502220463975,37.75731242536584],type:Point}",filed,wood frame (5)
apartments,5,2021-06-23T00:00:00.000,52,5,202106233009,"building 2 unit 310: like for like; remove and replace; (1) kitchen cabinets, countertops, sink and faucet. (1) bathroom vanity, sink, faucet & toilet. lighting fixtures, outlets, switches w/covers; no fire sprinkler/alarm modifications. no removing walls.",30000,Bayside Village,6,Pl,300A,2021-06-23T00:00:00.000,0,3773,4,4,Financial District/South Beach,otc alterations permit,8,2021-06-23T00:00:00.000,94107,1619375471173,wood frame (5),30000,1,apartments,52,"{coordinates:[-122.38966517583965,37.7843531507164],type:Point}",issued,wood frame (5)
1 family dwelling,5,2021-06-24T00:00:00.000,1,5,202106233045,"remodeling of 3 bathrooms, upgrade to 200 amp electri box. rewire home, office/bedroom converted to full bedroom at lower level",49000,Hazelwood,7,Av,022,2021-06-23T00:00:00.000,2,3038,2,2,West of Twin Peaks,otc alterations permit,8,2021-06-23T00:00:00.000,94127,1619419150634,wood frame (5),49000,477,1 family dwelling,1,"{coordinates:[-122.45862008502854,37.734360284450865],type:Point}",issued,wood frame (5)
1 family dwelling,5,2021-06-24T00:00:00.000,1,5,202106233065,revision to bpa#202101052102. add a new roof hatch only.,6500,Elsie,9,St,025,2021-06-23T00:00:00.000,2,5612,3,3,Bernal Heights,otc alterations permit,8,2021-06-23T00:00:00.000,94110,1619442184748,wood frame (5),6500,86,1 family dwelling,1,"{coordinates:[-122.41732189455873,37.743698670096784],type:Point}",issued,wood frame (5)
office,5,2021-06-23T00:00:00.000,0,5,202106233069,"a vacant 15,000 plus or minus space on the 2nd floor is to be built out to a new office space. this permit is for architectural work only. mep, sprinkler, and fire/life safety will be applied later.",0,16th,9,St,001,2021-06-23T00:00:00.000,2,3966,4,4,Mission,otc alterations permit,8,2021-06-23T00:00:00.000,94110,1619447352608,wood frame (5),500000,2525,office,0,"{coordinates:[-122.41189738504472,37.76512150090508],type:Point}",filed,wood frame (5)
apartments,5,2021-06-23T00:00:00.000,28,5,202106233024,"unit 9: replace kit cabinet, sink, counter-top sink, countertop, flooring bathroom vanity,vanity top, toilet, tub. all work in kind. no structural work. one kitchen & one bathroom non structural.",25000,La Playa,4,,001,2021-06-23T00:00:00.000,0,1804,3,3,Sunset/Parkside,otc alterations permit,8,2021-06-23T00:00:00.000,94122,1619393114984,wood frame (5),15000,1301,apartments,28,"{coordinates:[-122.5093872079579,37.761554713345205],type:Point}",issued,wood frame (5)
2 family dwelling,,2021-06-23T00:00:00.000,,,202106233083,re-roofing: remove and replace roofing material / existing roofing material (in-kind),9800,22nd,9,St,035,2021-06-23T00:00:00.000,0,4149,,,Mission,otc alterations permit,8,2021-06-23T00:00:00.000,94110,1619462171286,,9800,2815,2 family dwelling,,"{coordinates:[-122.41075756538012,37.755686393324254],type:Point}",issued,
2 family dwelling,5,2021-06-29T00:00:00.000,2,5,202106233085,upper unit: remodel bath & add one bath.,28000,10th,7,Av,028B,2021-06-23T00:00:00.000,2,1855,3,3,Inner Sunset,otc alterations permit,8,2021-06-23T00:00:00.000,94122,1619465117367,wood frame (5),28000,1562,2 family dwelling,2,"{coordinates:[-122.46671202650649,37.75910682340725],type:Point}",issued,wood frame (5)
apartments,5,2021-06-23T00:00:00.000,7,5,202106233053,"renovate (e) bathroom and (e) kitchen. new flooring, lighting. replace (e) wood fireplace with a gas fireplace. replace (e) wall heater with electric radiant heaters.",0,Fella,3,Pl,032,2021-06-23T00:00:00.000,2,0272,4,4,Nob Hill,otc alterations permit,8,2021-06-23T00:00:00.000,94108,161942866265,wood frame (5),30000,5,apartments,7,"{coordinates:[-122.40835536635629,37.79077635157873],type:Point}",filed,wood frame (5)
apartments,5,2021-06-23T00:00:00.000,12,5,202106233037,"unit 4a: window replacement in backof house, replace (3) windows (e) aluminum w/vinyl like-for-like retrofit",3100,Divisadero,2,St,037,2021-06-23T00:00:00.000,0,1025,4,4,Pacific Heights,otc alterations permit,8,2021-06-23T00:00:00.000,94115,1619409238862,wood frame (5),3100,2009,apartments,12,"{coordinates:[-122.4408209251682,37.788281830464044],type:Point}",issued,wood frame (5)
,5,2021-06-23T00:00:00.000,1,5,202106233082,"scope: fire sprinklers per nfpa 13r, 2016. all 3 levels of sfr & addition are in scope of work includes domestic/fire water services, back flow/underground to project w/approved back flow device per nfpa 13r. all work shall meet city codes & standards.",0,Harrison,9,St,030,2021-06-23T00:00:00.000,2,4147,2,3,Mission,otc alterations permit,8,2021-06-23T00:00:00.000,94110,1619461171205,wood frame (5),20069,2517,,1,"{coordinates:[-122.41198981240038,37.75687916528727],type:Point}",filed,wood frame (5)
,1,2021-06-23T00:00:00.000,0,1,202106233051,"as-built: modify existing fire alarm system. install (2) relays, (21) speaker strobes amd (4) strobes. revision to approved pa # 2020-0121-3035 (as-built)",0,Townsend,6,St,009,2021-06-23T00:00:00.000,2,3783,6,6,South of Market,otc alterations permit,8,2021-06-23T00:00:00.000,94103,1619426348556,constr type 1,1,650,,0,"{coordinates:[-122.40354610725294,37.771022380166784],type:Point}",filed,constr type 1
2 family dwelling,5,2021-06-23T00:00:00.000,2,5,202106233017,repair and replace outside siding in rear of the house - 1400sf of exterior siding,12600,27th,1,Av,032,2021-06-23T00:00:00.000,0,1407,3,3,Outer Richmond,otc alterations permit,8,2021-06-23T00:00:00.000,94131,161938298421,wood frame (5),4200,350,2 family dwelling,2,"{coordinates:[-122.48675268158969,37.7828355659929],type:Point}",issued,wood frame (5)
2 family dwelling,5,2021-06-23T00:00:00.000,2,5,202106233055,"bathroom addition into (e) footprint. framing walls. no structural work. 2 outlest, 5 lights, faucet, shower valve, toilet.",22000,Shotwell,9,St,083,2021-06-23T00:00:00.000,2,3611,2,2,Mission,otc alterations permit,8,2021-06-23T00:00:00.000,94110,1619431452422,wood frame (5),22000,661,2 family dwelling,2,"{coordinates:[-122.41537266570501,37.757877015098366],type:Point}",issued,wood frame (5)
1 family dwelling,5,2021-06-23T00:00:00.000,1,5,202106233011,reroofing,16385,Thomas,10,Av,010,2021-06-23T00:00:00.000,0,5359,2,2,Bayview Hunters Point,otc alterations permit,8,2021-06-23T00:00:00.000,94124,1619376364390,wood frame (5),16384.65,1616,1 family dwelling,1,"{coordinates:[-122.39144490303056,37.730802913567516],type:Point}",issued,wood frame (5)
apartments,5,2021-06-23T00:00:00.000,30,5,202106233015,"unit #605: remodeling kitchen remodeling bathroom",36800,Pacific,2,Av,013,2021-06-23T00:00:00.000,0,0576,6,6,Pacific Heights,otc alterations permit,8,2021-06-23T00:00:00.000,94109,1619380420404,wood frame (5),25000,1870,apartments,30,"{coordinates:[-122.42595251686359,37.79474248287709],type:Point}",issued,wood frame (5)
,1,2021-06-23T00:00:00.000,,1,202106233078,errcs sf rebanding. replace antenna and bda.,10000,Market,6,St,030,2021-06-23T00:00:00.000,2,3504,9,9,Mission,otc alterations permit,8,2021-06-23T00:00:00.000,94103,1619456156230,constr type 1,10000,1699,,,"{coordinates:[-122.42193576313304,37.772331443993224],type:Point}",filed,constr type 1
apartments,5,2021-06-23T00:00:00.000,28,5,202106233020,"unit 11: replace kitchen ccabinet, sink, ctop, flooring, bathroom vanity, vanity top, toilet, tub.",25000,La Playa,4,,001,2021-06-23T00:00:00.000,0,1804,3,3,Sunset/Parkside,otc alterations permit,8,2021-06-23T00:00:00.000,94122,1619389114984,wood frame (5),15000,1301,apartments,28,"{coordinates:[-122.5093872079579,37.761554713345205],type:Point}",issued,wood frame (5)
2 family dwelling,5,2021-06-23T00:00:00.000,2,5,202106233026,reroofing,25000,Church,8,St,004,2021-06-23T00:00:00.000,0,3585,3,3,Castro/Upper Market,otc alterations permit,8,2021-06-23T00:00:00.000,94114,1619395160198,wood frame (5),25000,634,2 family dwelling,2,"{coordinates:[-122.42861829931685,37.76073905639399],type:Point}",issued,wood frame (5)
apartments,5,2021-06-23T00:00:00.000,28,5,202106233018,"unit #26: replace kitchen cabinet, sink, countertop, flooring, bathroom vanity, vanity top, toilet, tub. all work in kind, no structural work. 1 kitchen and 1 bath remodel",36800,La Playa,4,,001,2021-06-23T00:00:00.000,0,1804,2,2,Sunset/Parkside,otc alterations permit,8,2021-06-23T00:00:00.000,94122,1619384244773,wood frame (5),15000,1301,apartments,28,"{coordinates:[-122.5093872079579,37.761554713345205],type:Point}",issued,wood frame (5)
,2,2021-06-23T00:00:00.000,0,2,202106233056,provide an upgrade/one-for-one replacement of the existing fire alarm detection and control system. the notification portion of this system is existing and to remain with no modifications. omly the detection/controls portion of system are to be replaced/upgraded. this includes replacement of control,0,Mission,6,St,093,2021-06-23T00:00:00.000,2,3725,4,4,South of Market,otc alterations permit,8,2021-06-23T00:00:00.000,94103,1619434164837,constr type 2,38672.61,901,,0,"{coordinates:[-122.40659970295958,37.782153924494494],type:Point}",filed,constr type 2
2 family dwelling,5,2021-06-23T00:00:00.000,2,5,202106233050,unit 1660: add one skylight. unit 1658: add one skylight.,0,Florida,9,St,008,2021-06-23T00:00:00.000,2,5515,3,3,Bernal Heights,otc alterations permit,8,2021-06-23T00:00:00.000,94110,1619425390917,wood frame (5),3500,1660,2 family dwelling,2,"{coordinates:[-122.4092634550686,37.746839034746955],type:Point}",filed,wood frame (5)
apartments,5,2021-06-23T00:00:00.000,28,5,202106233020,"unit 11: replace kitchen ccabinet, sink, ctop, flooring, bathroom vanity, vanity top, toilet, tub.",25000,La Playa,4,,001,2021-06-23T00:00:00.000,0,1804,3,3,Sunset/Parkside,otc alterations permit,8,2021-06-23T00:00:00.000,94122,1619420466921,wood frame (5),15000,1361,apartments,28,"{coordinates:[-122.5093872079579,37.761554713345205],type:Point}",issued,wood frame (5)
apartments,5,2021-06-23T00:00:00.000,3,5,202106233074,interior alteration: remodel kitchen. no structural work.,0,Church,8,St,085,2021-06-23T00:00:00.000,2,3620,2,2,Noe Valley,otc alterations permit,8,2021-06-23T00:00:00.000,94114,1619452462972,wood frame (5),15000,934,apartments,3,"{coordinates:[-122.42815614289526,37.755898150334076],type:Point}",filed,wood frame (5)
apartments,5,2021-06-23T00:00:00.000,25,5,202106233012,"unit #201: remodeling kitchen remodeling bathroom",36800,Taylor,3,St,005,2021-06-23T00:00:00.000,0,0214,5,5,Nob Hill,otc alterations permit,8,2021-06-23T00:00:00.000,94108,1619378413292,wood frame (5),25000,1225,apartments,25,"{coordinates:[-122.41330480376962,37.79377378775563],type:Point}",issued,wood frame (5)
2 family dwelling,5,2021-06-23T00:00:00.000,2,5,202106233026,reroofing,25000,Church,8,St,004,2021-06-23T00:00:00.000,0,3585,3,3,Castro/Upper Market,otc alterations permit,8,2021-06-23T00:00:00.000,94114,1619396378827,wood frame (5),25000,636,2 family dwelling,2,"{coordinates:[-122.42861829931685,37.76073905639399],type:Point}",issued,wood frame (5)
apartments,5,2021-06-23T00:00:00.000,28,5,202106233024,"unit 9: replace kit cabinet, sink, counter-top sink, countertop, flooring bathroom vanity,vanity top, toilet, tub. all work in kind. no structural work. one kitchen & one bathroom non structural.",25000,La Playa,4,,001,2021-06-23T00:00:00.000,0,1804,3,3,Sunset/Parkside,otc alterations permit,8,2021-06-23T00:00:00.000,94122,1619394466921,wood frame (5),15000,1361,apartments,28,"{coordinates:[-122.5093872079579,37.761554713345205],type:Point}",issued,wood frame (5)
2 family dwelling,5,2021-07-01T00:00:00.000,2,5,202106233066,remove & replace emergency exit stair in-kind. interior stair not visible from the street.,30000,Grove,5,St,028,2021-06-23T00:00:00.000,2,0803,3,3,Hayes Valley,otc alterations permit,8,2021-06-23T00:00:00.000,94117,161944381885,wood frame (5),30000,943,2 family dwelling,2,"{coordinates:[-122.43207880428628,37.776391981705245],type:Point}",issued,wood frame (5)
2 family dwelling,5,2021-06-23T00:00:00.000,2,5,202106233028,reroofing,18700,37th,1,Av,007,2021-06-23T00:00:00.000,0,1507,3,3,Outer Richmond,otc alterations permit,8,2021-06-23T00:00:00.000,94121,1619399432351,wood frame (5),18700,539,2 family dwelling,2,"{coordinates:[-122.49786053228311,37.77866987307762],type:Point}",issued,wood frame (5)
apartments,1,2021-06-23T00:00:00.000,138,1,202106233038,unit 4a:  install waste & water for laundry. build oak partition wall & ceiling for laundry. install electrical for laundry. update electrical panel.,5600,Gough,5,St,046,2021-06-23T00:00:00.000,2,0713,26,26,Western Addition,otc alterations permit,8,2021-06-23T00:00:00.000,94109,161941180171,constr type 1,5600,1200,apartments,138,"{coordinates:[-122.4241339072413,37.7848211551145],type:Point}",issued,constr type 1
2 family dwelling,5,2021-06-23T00:00:00.000,2,5,202106233017,repair and replace outside siding in rear of the house - 1400sf of exterior siding,12600,27th,1,Av,032,2021-06-23T00:00:00.000,0,1407,3,3,Outer Richmond,otc alterations permit,8,2021-06-23T00:00:00.000,94131,1619383357796,wood frame (5),4200,352,2 family dwelling,2,"{coordinates:[-122.48675268158969,37.7828355659929],type:Point}",issued,wood frame (5)
1 family dwelling,5,2021-06-23T00:00:00.000,1,5,202106233029,remove old tile and carpet. add wood flooring. retile bathroom floor and kitchen,1200,York,9,St,016,2021-06-23T00:00:00.000,0,4334,2,2,Mission,otc alterations permit,8,2021-06-23T00:00:00.000,94110,1619400173463,wood frame (5),1200,1423,1 family dwelling,1,"{coordinates:[-122.4075679025161,37.749347125878714],type:Point}",filed,wood frame (5)
apartments,5,2021-06-23T00:00:00.000,30,5,202106233043,unit 21: demo & repair less than 50 sf of stucco for waterproofing & add flashing. not visible from street.,10000,Minnesota,10,St,148,2021-06-23T00:00:00.000,0,4228,4,4,Potrero Hill,otc alterations permit,8,2021-06-23T00:00:00.000,94107,1619416425264,wood frame (5),10000,1310,apartments,30,"{coordinates:[-122.39006834720566,37.753699913944274],type:Point}",issued,wood frame (5)
1 family dwelling,5,2021-06-23T00:00:00.000,1,5,202106233047,"demolition & rebuilding exterior stairs, concrete, frming, granite & stucco, iron handrails",0,Naylor,11,St,019,2021-06-23T00:00:00.000,2,6442,2,2,Excelsior,otc alterations permit,8,2021-06-23T00:00:00.000,94112,1619421203192,wood frame (5),30000,7,1 family dwelling,1,"{coordinates:[-122.43382310120093,37.71134816694466],type:Point}",filed,wood frame (5)
